{
  "authority_id": "AUTH-738928EF70D1ED96694C",
  "branch_policy": {
    "baseline_commit": "reported_by_branch_init_worker",
    "branch": "campaign/camp-1978d675437a7442d019",
    "required": true
  },
  "campaign_id": "CAMP-1978D675437A7442D019",
  "compilation_digest": "a2b9183a5ea8b03b95b06bc6105a22396aabf944924fc2a19cf7fa3f0988f983",
  "context_snapshots": [],
  "created_at": "2026-08-07T11:56:26.343101Z",
  "entry_contract": [
    "goal"
  ],
  "envelope_id": "ENV-CBCD30CB2EEEDFBCB2EA",
  "exit_contract": [
    "goal_judgment"
  ],
  "goal": "Investigate why TDE mode hangs Chrome browser and implement a fix",
  "limits": {
    "max_concurrency": 8,
    "max_cycles": 20,
    "max_expansions": 64,
    "max_jobs_per_cycle": 64,
    "max_jobs_per_expansion": 32,
    "max_total_jobs": 512
  },
  "mutating": true,
  "phase_configurations": {},
  "phase_sequence": [
    "branch_init",
    "proposal_explore",
    "proposal_architect",
    "proposal_finalize",
    "proposal_review",
    "implementation_planning",
    "implementation",
    "deterministic_checks",
    "verification",
    "implementation_review",
    "openspec_sync",
    "openspec_archive",
    "cycle_commit",
    "cycle_push",
    "remote_verification",
    "goal_judge"
  ],
  "publication_policy": {
    "deployment": false,
    "destructive_migration": false,
    "merge": false,
    "pull_request": false,
    "release": false
  },
  "repository_target": "C:\\Projects\\BlackholeSim",
  "safety_invariants": [
    "independent_verification",
    "recovery",
    "root_isolation",
    "goal_judge_authority",
    "no_false_completion"
  ],
  "schema_version": 6,
  "strategy": "default_adaptive",
  "strategy_digest": "80e2f1d66914f9ce464e61b0b746f2ce19c3be09e59826524b7bfb0dd57232d9",
  "strategy_mode": "full_campaign",
  "version": 1
}
